{
  "schemaVersion": 1,
  "id": "classification",
  "title": "Classification",
  "description": "Binary classification with logistic regression: turning a weighted sum into a probability with the sigmoid function, thresholding it into a class prediction, and evaluating the result.",
  "estMinutes": 80,
  "prerequisites": [
    "regression",
    "ml-concepts-data-and-evaluation"
  ],
  "objectives": [
    "Distinguish binary classification (predicting one of two classes) from regression (predicting a continuous number)",
    "Compute the logistic regression pre-activation z = wx + b and its sigmoid probability sigma(z)",
    "Apply a decision threshold to convert a predicted probability into a class prediction",
    "Identify a classifier's decision boundary and interpret it geometrically",
    "Evaluate a classifier's predictions against true labels using a confusion matrix, precision and recall"
  ],
  "tags": ["ai", "machine-learning", "classification", "logistic-regression", "sigmoid", "evaluation"],
  "lessons": [
    { "id": "binary-classification", "title": "Binary classification: a category, not a number", "file": "01-binary-classification.md", "estMinutes": 20 },
    { "id": "logistic-regression-sigmoid", "title": "Logistic regression: weighted sum, sigmoid, threshold", "file": "02-logistic-regression-sigmoid.md", "estMinutes": 30 },
    { "id": "decision-boundaries-and-evaluation", "title": "Decision boundaries and evaluating a classifier", "file": "03-decision-boundaries-and-evaluation.md", "estMinutes": 30 }
  ],
  "assessment": { "file": "assessment.json", "passMark": 0.7 },
  "version": "1.0.0",
  "authors": ["charles"]
}
