{
  "schemaVersion": 1,
  "id": "modern-ai-transformers-and-llms",
  "title": "Modern AI: Transformers and Large Language Models",
  "description": "How words become vectors, how attention and the transformer architecture work, and how large language models are trained, used, and can go wrong.",
  "estMinutes": 85,
  "prerequisites": [
    "neural-networks-2-training"
  ],
  "objectives": [
    "Explain how word embeddings represent meaning as vectors of numbers, so that similar words end up close together",
    "Describe, in intuitive terms, how the attention mechanism lets each word weigh the relevance of every other word in a sequence",
    "Describe the transformer architecture at a high level, including how it differs from older word-by-word (RNN) approaches",
    "Explain what pretraining and fine-tuning are, and how together they produce a large language model",
    "Identify well-known capabilities and limitations of LLMs, including hallucination, lack of true understanding, prompt sensitivity, and training-data bias"
  ],
  "tags": ["ai", "llm", "transformer", "attention", "embeddings", "nlp"],
  "lessons": [
    {
      "id": "word-embeddings",
      "title": "Word embeddings: representing meaning as vectors",
      "file": "01-word-embeddings.md",
      "estMinutes": 25
    },
    {
      "id": "attention-and-transformers",
      "title": "Attention and the transformer architecture",
      "file": "02-attention-and-transformers.md",
      "estMinutes": 30
    },
    {
      "id": "llms-training-and-limitations",
      "title": "Large language models: training, capabilities and limitations",
      "file": "03-llms-training-and-limitations.md",
      "estMinutes": 30
    }
  ],
  "assessment": {
    "file": "assessment.json",
    "passMark": 0.7
  },
  "version": "1.0.0",
  "authors": ["charles"]
}
