{
  "schemaVersion": 1,
  "id": "normal-distribution",
  "title": "The Normal Distribution",
  "description": "The normal distribution as a continuous probability model for data that clusters symmetrically around a mean; standardising to Z and using the standard normal distribution to find probabilities and unknown values.",
  "estMinutes": 100,
  "prerequisites": [
    "probability",
    "binomial-distribution"
  ],
  "objectives": [
    "Describe the normal distribution N(mu, sigma^2) as a symmetric, bell-shaped continuous probability model",
    "Standardise a normal variable using Z = (X - mu) / sigma to obtain a standard normal Z ~ N(0,1)",
    "Use the standard normal CDF Phi(z) to find P(X < a), P(X > a) and P(a < X < b) for a given normal distribution",
    "Find an unknown value a from a given probability using the inverse normal method",
    "Approximate a binomial distribution B(n,p) by a normal distribution for large n, applying a continuity correction"
  ],
  "tags": ["statistics", "normal-distribution", "probability", "standardising", "continuity-correction"],
  "lessons": [
    {
      "id": "normal-distribution-shape",
      "title": "The normal distribution and standardising",
      "file": "01-normal-distribution.md",
      "estMinutes": 30
    },
    {
      "id": "standard-normal-probabilities",
      "title": "Using Phi(z) to find probabilities",
      "file": "02-standard-normal-probabilities.md",
      "estMinutes": 35
    },
    {
      "id": "inverse-normal-and-approximation",
      "title": "Inverse normal, and approximating a binomial",
      "file": "03-inverse-normal-and-approximation.md",
      "estMinutes": 35
    }
  ],
  "assessment": {
    "file": "assessment.json",
    "passMark": 0.7
  },
  "version": "1.0.0",
  "authors": ["charleschristy325"]
}
