{
  "schemaVersion": 1,
  "id": "quadratics-intro",
  "title": "Introduction to Quadratics",
  "description": "A first, GCSE-grade look at quadratic expressions: what makes an expression quadratic, expanding brackets to form one, factorising and solving simple cases, and the basic parabola shape.",
  "estMinutes": 70,
  "prerequisites": [
    "algebra-essentials"
  ],
  "objectives": [
    "Recognise a quadratic expression written as $ax^2+bx+c$ and identify $a$, $b$ and $c$",
    "Expand a pair of brackets such as $(x+p)(x+q)$ to obtain a quadratic expression",
    "Factorise simple quadratics $x^2+bx+c$ using integer factor pairs",
    "Solve a quadratic equation in factorised form by setting each factor equal to zero",
    "Describe the basic shape of a parabola and explain how the sign of $a$ decides whether it is u-shaped or n-shaped",
    "Find where a parabola crosses the x-axis directly from its factorised form"
  ],
  "tags": ["algebra", "quadratics", "factorising", "parabola", "gcse"],
  "lessons": [
    { "id": "what-is-a-quadratic", "title": "What is a quadratic? Expanding brackets", "file": "01-what-is-a-quadratic.md", "estMinutes": 22 },
    { "id": "factorising-and-solving", "title": "Factorising and solving simple quadratics", "file": "02-factorising-and-solving.md", "estMinutes": 26 },
    { "id": "the-parabola-shape", "title": "The parabola shape and x-intercepts", "file": "03-the-parabola-shape.md", "estMinutes": 22 }
  ],
  "assessment": { "file": "assessment.json", "passMark": 0.7 },
  "version": "1.0.0",
  "authors": ["learnlab"]
}
