{
  "schemaVersion": 1,
  "id": "materials",
  "title": "Materials",
  "description": "Density, Hooke's law and elastic strain energy, tensile stress, strain and the Young modulus, and how stress-strain graphs distinguish brittle, ductile and polymeric material behaviour.",
  "estMinutes": 100,
  "prerequisites": [
    "mechanics-and-energy"
  ],
  "objectives": [
    "Calculate density from mass and volume, and rearrange the density equation",
    "State Hooke's law and use F = kx up to the limit of proportionality",
    "Distinguish elastic from plastic deformation, and calculate elastic strain energy from a force-extension graph",
    "Define and calculate tensile stress, tensile strain and the Young modulus",
    "Interpret a stress-strain graph, identifying the limit of proportionality, elastic limit, yield point, ultimate tensile stress and breaking stress",
    "Compare the stress-strain behaviour of brittle, ductile and polymeric materials"
  ],
  "tags": ["materials", "density", "hookes-law", "stress", "strain", "young-modulus", "stress-strain-graph"],
  "lessons": [
    { "id": "density-and-hookes-law", "title": "Density and Hooke's law", "file": "01-density-and-hookes-law.md", "estMinutes": 35 },
    { "id": "stress-strain-young-modulus", "title": "Stress, strain and the Young modulus", "file": "02-stress-strain-young-modulus.md", "estMinutes": 35 },
    { "id": "stress-strain-graphs-material-behaviour", "title": "Stress-strain graphs and material behaviour", "file": "03-stress-strain-graphs-material-behaviour.md", "estMinutes": 30 }
  ],
  "assessment": { "file": "assessment.json", "passMark": 0.7 },
  "version": "1.0.0",
  "authors": ["learnlab"]
}
