{
  "schemaVersion": 1,
  "id": "missing-lesson-module",
  "title": "Fixture Module",
  "description": "Invalid-fixture module.",
  "estMinutes": 30,
  "prerequisites": [],
  "objectives": ["Objective one", "Objective two"],
  "lessons": [{ "id": "only", "title": "Only Lesson", "file": "01-only.md", "estMinutes": 30 }],
  "version": "1.0.0",
  "authors": ["fixture"]
}
