{
  "schemaVersion": 1,
  "id": "differentiation-2",
  "title": "Differentiation II — Chain, Product and Quotient Rules",
  "description": "Differentiating composite, product and quotient functions; the standard derivatives of sin x, cos x, tan x, e^x and ln x; connected rates of change; and using stationary points and the second derivative to sketch curves.",
  "estMinutes": 110,
  "prerequisites": [
    "differentiation-1",
    "trigonometry-1",
    "trigonometry-2",
    "exponentials-and-logarithms"
  ],
  "objectives": [
    "Differentiate a composite function f(g(x)) using the chain rule",
    "Differentiate a product uv using the product rule and a quotient u/v using the quotient rule",
    "Recall and use the standard derivatives of sin x, cos x, tan x, e^x and ln x",
    "Apply the chain rule to connected rates of change problems",
    "Find stationary points by solving f'(x) = 0 and classify them using the second derivative",
    "Combine these techniques to sketch the graph of a function"
  ],
  "tags": ["calculus", "derivative", "chain-rule", "product-rule", "quotient-rule", "stationary-points", "curve-sketching"],
  "lessons": [
    { "id": "chain-rule", "title": "The chain rule", "file": "01-chain-rule.md", "estMinutes": 25 },
    { "id": "product-quotient-rules", "title": "The product and quotient rules", "file": "02-product-quotient-rules.md", "estMinutes": 25 },
    { "id": "standard-derivatives", "title": "Standard derivatives and connected rates of change", "file": "03-standard-derivatives.md", "estMinutes": 30 },
    { "id": "stationary-points", "title": "Stationary points and curve sketching", "file": "04-stationary-points.md", "estMinutes": 30 }
  ],
  "assessment": { "file": "assessment.json", "passMark": 0.7 },
  "version": "1.0.0",
  "authors": ["learnlab"]
}
