{
  "schemaVersion": 1,
  "id": "data-representation",
  "title": "Data Representation",
  "description": "How computers store numbers, text, images and sound as binary: number bases, binary arithmetic, two's complement negative numbers, floating-point, and character/image/sound encoding.",
  "estMinutes": 105,
  "prerequisites": ["programming-fundamentals"],
  "objectives": [
    "Convert numbers between binary, denary and hexadecimal",
    "Add binary numbers of a fixed bit-width and identify when overflow occurs",
    "Represent and interpret negative integers using two's complement for a fixed bit-width",
    "Explain fixed-point and simplified floating-point (sign, mantissa, exponent) representation of real numbers",
    "Explain how character sets (ASCII, extended ASCII, Unicode/UTF-8) encode text as binary",
    "Calculate the storage requirements of simple images and sound from resolution, colour depth, sample rate and bit depth"
  ],
  "tags": ["binary", "hexadecimal", "twos-complement", "floating-point", "ascii", "unicode", "bitmap", "sound"],
  "lessons": [
    { "id": "number-bases", "title": "Binary, denary and hexadecimal", "file": "01-number-bases.md", "estMinutes": 25 },
    { "id": "binary-arithmetic-twos-complement", "title": "Binary arithmetic and two's complement", "file": "02-binary-arithmetic-twos-complement.md", "estMinutes": 30 },
    { "id": "floating-point-representation", "title": "Fixed-point and floating-point representation", "file": "03-floating-point-representation.md", "estMinutes": 25 },
    { "id": "text-images-sound", "title": "Representing text, images and sound", "file": "04-text-images-sound.md", "estMinutes": 25 }
  ],
  "assessment": { "file": "assessment.json", "passMark": 0.7 },
  "version": "1.0.0",
  "authors": ["charles"]
}
